"jobTitle","category","companyName","vacancy","jobContext","jobDescription","employmentStatus","educationalReq","additionalReq","jobLocation","salary"
"Software Engineer (Access Control)","Engineer Architect","Walton Digi-Tech Industries Ltd.","1","We are looking for a skilled Software Engineer to join our thriving team. You will be responsible for the software development of Access Control products and software automation that enables facilities and security to support thousands of users in their interaction with buildings around the world.","Collect requirements from clients, analysis, and system design and be responsible for creating/ developing large-scale applications.","Full-time","B.Sc in CSE from any reputed university","Age at least 25 years","Gazipur (Kaliakair)","Negotiable""jobTitle","category","companyName","vacancy","jobContext","jobDescription","employmentStatus","educationalReq","additionalReq","jobLocation","salary"
"Anodization Plant Manager","Engineer Architect","Bangladesh Thai Aluminium Ltd","01","This is a full-time job. The employee is expected to mix chemical, check chemical parameters, familiarity with chemical baths, surface preparation, anodization coating thickness measurement, and quality inspection.","","Full-time","Bachelor of Science (BSc) in Chemistry","Age 25 to 35 years","Gazipur (Kaliakair)","Negotiable""jobTitle","category","companyName","vacancy","jobContext","jobDescription","employmentStatus","educationalReq","additionalReq","jobLocation","salary"
"Head Of IE","Engineer Architect","DEKKO ISHO Group","1","Identify the bottlenecks in the processes, analyze the problem and implement changes to achieve continuous process improvement.
Develops and implements plans that ensure the effective utilization of people, facilities and equipment enabling the achievement of program delivery.
Analyzes operational processes and develops performance metrics and reporting to optimize and improve productivity and efficiency of operations.
Identify and deploy the cost reduction measures in every step of the processes.
Utilize lean manufacturing ideology to design and execute innovative floor plans and value addition.","Identify the bottlenecks in the processes, analyze the problem and implement changes to achieve continuous process improvement.","Full-time","O Level","Age 35 to 40 years","Dhaka (Tejgaon)","Negotiable""jobTitle","category","companyName","vacancy","jobContext","jobDescription","employmentStatus","educationalReq","additionalReq","jobLocation","salary"
"Assistant Manager/ Deputy Manager - Environment, Health and Safety (EHS)","Engineer Architect","GPH Ispat Ltd","Not specific","Coordinate and conduct Central HS Training Program for management, non-management and contractor personnel.
Coordinate and conduct Gap Analysis, Risk Assessment and Develop Actions Plan and Follow up in accordance to the Company Standard and Advisory requirements.
Assess, develop and distribute HS signage and posters for site and keep continuous liaison with different operation In-charges, Safety Professionals, Engineers & Contractors for bringing better visibility and awareness related to EHS Issues throughout the company.
Participate in the internal audits according to develop internal audit schedule and follow up the recommended actions for proper and timely implementation.
Prepare different Reports for this company on a weekly, monthly and quarterly basis and coordinate and follow up internal reporting from sites to maintain a smooth central reporting system.
Ensure full compliance on reviewed standards Work at Heights (confirm no major WAH gaps exist at site), steel process hazards and energy isolation along with Safe electrical work practices.
Establish HAZCOM by completing gap analysis and action implementation.
Conduct site auditing for application of Reward and Discipline matrix.
Extent SLDP model locations by developing new area ownership and full implementation and ensure sustainability of the current model locations as per guideline.
Maintain the Database System for incidents and accidents and follow up the action status for proper completion for reducing the reoccurrence of the unwanted events and achieving the ""Company Zero Accident Targets"".
Ensure routine and Non-routine visit to different operations to conduct HS inspections, investigations and act as a central support system in case of emergency crisis.
Conduct Site Permit to Work auditing and find out improvement area on monthly basis to ensure the implementation of Reward and Disciplinary policy. Also help the area owners to complete the assigned tasks.
Deliver Annual Health and Safety plan and monitor actions, obtain quarterly review of the plan approved by the Managing Director.
Facilitate HS Committee meeting and keep minutes of the meeting and follow up of actions for close the CAP.
To ensure EHS compliance as per law and standard.
To ensure IMS standard and face internal and external IMS audit.
Facilitate improvement in Job Safety Analysis (Risk Assessment) involving contractor workers in terms of Task observation, review of existing risk assessment, improve the work instructions and establish a standard document for job briefing for all routine and non-routine jobs.
Maintain interface with the Fire Wardens, First Aiders and Security Focal Point, Emergency Evacuation (Office), Fire Drills, Security Drills, First Aid and Medevac.
Encourage reporting Unsafe Acts and Unsafe Condition (UAC)
Keep track of Unsafe Act and Condition reported by employees and contractor personnel, and keep record and follow up actions.
Keep record of all safety alerts and follow up of actions.
Review safety requirements for issuance of Permit to Work (PTW) for all safety critical activities.
Environmental sustainability and compliance monitoring.","Coordinate and conduct Central HS Training Program for management, non-management and contractor personnel.","Full-time","Bachelor degree in any discipline","Age at least 28 years","Chattogram (Sitakunda)","""jobTitle","category","companyName","vacancy","jobContext","jobDescription","employmentStatus","educationalReq","additionalReq","jobLocation","salary"
"Senior Commercial Executive/ Commercial Executive, Mechanical Engineering","Engineer Architect","Advanced Chemical Industries Limited (ACI)","Not specific","Purchase and Procurement of required materials ensuring high quality, cost      minimization, product customization, speed delivery with supplier`s competitiveness to meet functional requirement, drive down lead time as well as minimizing inventory.","Responsible for purchase including machineries, spare parts & other relevant technical service from both local & foreign suppliers/service providers.","Full-time","Graduation/ Post Graduation in Mechanical Engineering from any reputed Public or Private University.","Age 26 to 30 years","Dhaka","Negotiable""jobTitle","category","companyName","vacancy","jobContext","jobDescription","employmentStatus","educationalReq","additionalReq","jobLocation","salary"
"Service Manager","Engineer Architect","Walton Digi-Tech Industries Ltd.","3","Walton DigiTech Industries Ltd. is a pioneering tech company at the forefront of innovation. We`re seeking  passionate and detail-oriented Mechanical Designers to join our dynamic team for our Computer, Lifestyle and Security Surveillance Products.","Conducting research and development for IT products.","Full-time","Bachelor's degree in Engineering.","Age at least 25 years","Gazipur (Kaliakair)","Negotiable""jobTitle","category","companyName","vacancy","jobContext","jobDescription","employmentStatus","educationalReq","additionalReq","jobLocation","salary"
"Maintenance Engineer","Engineer Architect","LMT Transport","Not specific","LMT CO. is a leading construction company in Bangladesh, with a wide range of projects underway. We are looking for a highly skilled and experienced Heavy Equipment and Vehicle Maintenance Engineer to join our team.",".The successful candidate will be responsible for the following:","Full-time","Bachelor degree in any discipline","Age at least 18 years","Chattogram","""jobTitle","category","companyName","vacancy","jobContext","jobDescription","employmentStatus","educationalReq","additionalReq","jobLocation","salary"
"Manager/ Assistant General Manager (AGM) - eCommerce Operations","Engineer Architect","RANGS Industries Ltd. (RANGS eMART)","01","Job Summary:
The Manager/Assistant General Manager (AGM) of eCommerce Operations plays a crucial role in overseeing and optimizing the day-to-day operations of an eCommerce business. This position involves managing a team, ensuring seamless order fulfillment, monitoring inventory, and enhancing the customer shopping experience. The role combines operational excellence, team leadership, and a deep understanding of eCommerce processes.","Job Summary:","Full-time","Bachelor of Science (BSc) in CSE, IT, Bachelor of Business Administration (BBA), Master of Business Administration (MBA)","Age at least 34 years","Dhaka","NegotiableCompetitive Salary as per Experience Festival Bonus: 02 (75% of Gross pay)""jobTitle","category","companyName","vacancy","jobContext","jobDescription","employmentStatus","educationalReq","additionalReq","jobLocation","salary"
"Mechanical Designer","Engineer Architect","Walton Digi-Tech Industries Ltd.","2","Walton DigiTech Industries Ltd. is a pioneering tech company at the forefront of innovation. We`re seeking a passionate and detail-oriented Mechanical Designer to join our dynamic team.","Conducting research and development for IT products.","Full-time","Bachelor's degree in Mechanical Engineering or a related field.","Age at least 25 years","Gazipur (Kaliakair)","Negotiable""jobTitle","category","companyName","vacancy","jobContext","jobDescription","employmentStatus","educationalReq","additionalReq","jobLocation","salary"
"Project Coordinator","Engineer Architect","Akij Steel Mills Ltd.","Not specific","We are seeking a highly organized and detail-oriented Project Coordinator to join our team. As a Project Coordinator, you will play a crucial role in supporting the successful execution and completion of pre-engineered steel building projects. You will work closely with the project team, including engineers, architects, contractors, and suppliers, to ensure effective coordination and communication throughout the project lifecycle. The ideal candidate should have strong project coordination skills and a background in the construction industry, preferably in the field of pre-engineered steel buildings and structures.","To be responsible for coordination of the different projects which includes site supervision, planning, managing, coordinating, evaluating, controlling & completing the project of Pre-Fabricated Structures timely by assuring ASML’s standard guide-line & quality.","Full-time","Bachelor of Science (BSc) in Civil Engineering","Age 26 to 34 years","Anywhere in Bangladesh","Negotiable""jobTitle","category","companyName","vacancy","jobContext","jobDescription","employmentStatus","educationalReq","additionalReq","jobLocation","salary"
"Lead Robotics Engineer","Engineer Architect","Bengal Champ","01","We are seeking a highly skilled and motivated Lead Robotics Engineer to lead our robotics development team. As a Lead Robotics Engineer, you will play a pivotal role in driving the design, development, and implementation of advanced robotic systems. You will work closely with a talented team of engineers and researchers to solve complex challenges and deliver state-of-the-art robotics solutions.","Lead and mentor a team of robotics engineers, providing technical guidance and support.","Full-time","PhD in (preferred), Master of Science (MSc) in Robotics, Computer Science, Electrical & Electronic Engineering, or related field.","Age at least 30 years","Sylhet (Sylhet Sadar)","Tk. 60000 - 100000 (Monthly)What We Offer:
Competitive salary and benefits package.
Opportunity to work on cutting-edge robotics projects.
Collaborative and innovative work environment.
Career growth and development opportunities.
Chance to make a significant impact in the field of robotics.""jobTitle","category","companyName","vacancy","jobContext","jobDescription","employmentStatus","educationalReq","additionalReq","jobLocation","salary"
"Deputy Chief Engineer (Structure)","Engineer Architect","WASO Engineers & Consultants (BD) Ltd.","Not specific","For the Post of Lead Structural Engineer, you play a crucial role in planning and designing of high-rise buildings and structural components. Your responsibilities include creating detailed designs, ensuring compliance with engineering standards and regulations, and maintaining high-quality standards throughout construction. Your analytical, critical thinking and time management skills are essential for success in this role.","•	Prepare detailed designs and construction plans for high-rise buildings, structural elements, and components, along with associated specifications.","Full-time","Bachelor in Engineering (BEngg)","Age 35 to 45 years","Dhaka (Kalabagan)","Negotiable""jobTitle","category","companyName","vacancy","jobContext","jobDescription","employmentStatus","educationalReq","additionalReq","jobLocation","salary"
"Trainee Engineering Officer","Engineer Architect","US-Bangla Airlines","Not specific","The US-Bangla Airlines Ltd. (USBA), the largest private airline in the country (having Dash 8, Q-400, ATR 72-600, Boeing 737-800 and Airbus 330 joining soon) will hire some self-motivated, intelligent Engineering graduates as Trainee Engineering Officer for its Engineering Department.US-Bangla Airlines will provide the opportunity to the Trainee Engineering Officer (TEO) for taking module examination for Aircraft Maintenance Licenses. Once they complete all modules and other necessary prerequisites of Civil Aviation Authority of Bangladesh (CAAB), they will be placed for becoming Type Rated Engineer (TRE) on any specific type of Aircraft of the US-Bangla Airlines fleet.","The US-Bangla Airlines Ltd. (USBA), the largest private airline in the country (having Dash 8, Q-400, ATR 72-600, Boeing 737-800 and Airbus 330 joining soon) will hire some self-motivated, intelligent Engineering graduates as Trainee Engineering Officer for its Engineering Department.","Full-time","B.Sc in Mechanical/Electrical/Electrical and Electronics Engineering with minimum CGPA 3.00 (out of 4.00)","Age at most 24 years","Dhaka (Shahjalal Airport)","Tk. 35000 (Monthly)After obtaining Basic License salary will be Tk. 1,10,000/-
After becoming Type Rated Engineer (TRE) on any specific type of Aircraft of USBA fleet salary will be Tk. 2,00,000/-""jobTitle","category","companyName","vacancy","jobContext","jobDescription","employmentStatus","educationalReq","additionalReq","jobLocation","salary"
"Product Manager (Printer)","Engineer Architect","Walton Digi-Tech Industries Ltd.","1","Walton DigiTech Industries Ltd. is a leading tech manufacturer, dedicated to producing high-quality printers. Under the Product Management department, we specialize in the production of both Single and Multifunctional Printers.","Define the strategic direction for the printer category, aligning it with market trends and customer preferences.","Full-time","Bachelor's degree in Engineering, or a related field. MBA preferred","Age at least 25 years","Gazipur (Kaliakair)","Tk. 40000 - 60000 (Monthly)""jobTitle","category","companyName","vacancy","jobContext","jobDescription","employmentStatus","educationalReq","additionalReq","jobLocation","salary"
"Trainee Engineer - Slider (Diecasting,Enameling)","Engineer Architect","YKK Bangladesh Pte Ltd.","05","Chemical/Textile Engineer:Providing technical advice to production staff,product development,quality control staff.Daily developing new color by paint pigment recipe and update daily color list to maintain stock.Operating knowledge about spectrophometer, hero dispenser & gyro mixer machine.Ensure 5S & safety and prepare KYT based on section risk assessment.Using color measuring equipment, Light source to ensure color reliability in pigments.Color judgement capability both visual & numerical by using CCI (color computerinspection).Good understanding about GHS symbol & maintain SDS or MSDS during paint or chemical handling in Slider Enameling.Controlling sample & bulk production within same quality standards.Mechanical Engineer:Performs repairing & troubleshooting of pump & motor, maintenance, installation and adjustments.Perform machine inspection, corrective & preventive maintenance procedure to ensure all equipment are in good condition at all-time.Documents process and maintaining mechanical service records.Implement 5S, TPM, KYT, activities & safety system in the production floor.Excellent communication and collaboration skill.Any other task assign by the department manager.","Chemical/Textile Engineer:","Full-time","Diploma in Chemical/Mechanical/Textile Engineering.","Age at most 33 years","Dhaka (Savar EPZ)",""