"jobTitle","category","companyName","vacancy","jobContext","jobDescription","employmentStatus","educationalReq","additionalReq","jobLocation","salary"
"Executive Officer (Tender)","Engineer Architect","Nur Surgical","1","Office Work, OTM Tender, Manual Tender, EOI, RFQ. (Medical Equipment and Surgical Goods)","Tracking Tender Notices, Purchase of Tender Schedule, Detail Understanding of Tender Schedule.","Full-time","Minimum Bachelor degree in any discipline.","Age 23 to 28 years","Dhaka (DOHS Mohakhali)","Negotiable""jobTitle","category","companyName","vacancy","jobContext","jobDescription","employmentStatus","educationalReq","additionalReq","jobLocation","salary"
"Trainee Engineering Officer","Engineer Architect","US-Bangla Airlines","Not specific","The US-Bangla Airlines Ltd. (USBA), the largest private airline in the country (having Dash 8, Q-400, ATR 72-600, Boeing 737-800 and Airbus 330 joining soon) will hire some self-motivated, intelligent Engineering graduates as Trainee Engineering Officer for its Engineering Department.US-Bangla Airlines will provide the opportunity to the Trainee Engineering Officer (TEO) for taking module examination for Aircraft Maintenance Licenses. Once they complete all modules and other necessary prerequisites of Civil Aviation Authority of Bangladesh (CAAB), they will be placed for becoming Type Rated Engineer (TRE) on any specific type of Aircraft of the US-Bangla Airlines fleet.","The US-Bangla Airlines Ltd. (USBA), the largest private airline in the country (having Dash 8, Q-400, ATR 72-600, Boeing 737-800 and Airbus 330 joining soon) will hire some self-motivated, intelligent Engineering graduates as Trainee Engineering Officer for its Engineering Department.","Full-time","B.Sc in Mechanical/Electrical/Electrical and Electronics Engineering with minimum CGPA 3.00 (out of 4.00)","Age at most 24 years","Dhaka (Shahjalal Airport)","Tk. 35000 (Monthly)After obtaining Basic License salary will be Tk. 1,10,000/-
After becoming Type Rated Engineer (TRE) on any specific type of Aircraft of USBA fleet salary will be Tk. 2,00,000/-""jobTitle","category","companyName","vacancy","jobContext","jobDescription","employmentStatus","educationalReq","additionalReq","jobLocation","salary"
"Deputy Chief Engineer (Structure)","Engineer Architect","WASO Engineers & Consultants (BD) Ltd.","Not specific","For the Post of Lead Structural Engineer, you play a crucial role in planning and designing of high-rise buildings and structural components. Your responsibilities include creating detailed designs, ensuring compliance with engineering standards and regulations, and maintaining high-quality standards throughout construction. Your analytical, critical thinking and time management skills are essential for success in this role.","•	Prepare detailed designs and construction plans for high-rise buildings, structural elements, and components, along with associated specifications.","Full-time","Bachelor in Engineering (BEngg)","Age 35 to 45 years","Dhaka (Kalabagan)","Negotiable""jobTitle","category","companyName","vacancy","jobContext","jobDescription","employmentStatus","educationalReq","additionalReq","jobLocation","salary"
"Executive, Research & Innovation","Engineer Architect","Walton Digi-Tech Industries Ltd.","2","The R&I Executive will work under the supervision of senior R&D staff and assist in the design, development, and testing of new products or processes. The incumbent will be responsible for carrying out experiments, analyzing data, and contributing to technical reports.","Product testing, QA, and Circuit analysis.","Full-time","Bachelor of Science (BSc) in EEE","Age at least 24 years","Gazipur (Kaliakair)","Tk. 30000 - 45000 (Monthly)""jobTitle","category","companyName","vacancy","jobContext","jobDescription","employmentStatus","educationalReq","additionalReq","jobLocation","salary"
"Project Engineer / Site In-Charge","Engineer Architect","Reon Group","Not specific","•	This is key role that will be responsible for are site supervision, estimate, and quality control of all type of constructions, maintain and preparing all type of contractor`s bills.•	Workplace: Work at office and projects sites.","•	This is key role that will be responsible for are site supervision, estimate, and quality control of all type of constructions, maintain and preparing all type of contractor`s bills.","Full-time","Diploma in Civil","Age 20 to 35 years","Dhaka (Mohammadpur)","Negotiable""jobTitle","category","companyName","vacancy","jobContext","jobDescription","employmentStatus","educationalReq","additionalReq","jobLocation","salary"
"Quantity Engineer (Civil)","Engineer Architect","Neezer Bari Design & Construction","Not specific","We are seeking a skilled and experienced Quantity Engineer (Civil) to join our dynamic team. As a Quantity Engineer, you will play a pivotal role in ensuring the highest standards of quality and safety in our construction projects. Your expertise in Civil Engineering and proficiency in AutoCAD will be critical in maintaining our commitment to excellence. If you are passionate about delivering quality results in the construction industry and have a keen eye for detail, this is the perfect opportunity for you to contribute to our continued success.","We are seeking a skilled and experienced Quantity Engineer (Civil) to join our dynamic team. As a Quantity Engineer, you will play a pivotal role in ensuring the highest standards of quality and safety in our construction projects. Your expertise in Civil Engineering and proficiency in AutoCAD will be critical in maintaining our commitment to excellence. If you are passionate about delivering quality results in the construction industry and have a keen eye for detail, this is the perfect opportunity for you to contribute to our continued success.","Full-time","Diploma in Civil","Age at least 20 years","Dhaka (Lalmatia)","Tk. 12000 - 14000 (Monthly)""jobTitle","category","companyName","vacancy","jobContext","jobDescription","employmentStatus","educationalReq","additionalReq","jobLocation","salary"
"Executive - General Maintenance","Engineer Architect","MAS Intimates Bangladesh (Pvt.) Ltd.","1","Analyse the electricity data and report to the management in order to manage the EMS system effectively and minimize unwanted expenses. 
Should have the ability of installation/modifications and all maintenance activities in areas such as air conditioning, generators, air compressors etc in order to ensure that work is carried out as per requirements of the internal customer in order to create a favorable working environment.
Ensure adherence to energy saving initiatives in place in order to reduce waste and conserve energy
Coordinate with BEPZA or other relevant state departments to get the info. 
Assist in the preparation of the annual departmental budget and ensure that expenses are in line with requirements in order to meet the organizational  objectives
Plan & schedule preventive maintenance & breakdown maintenance and allocate resources, teams, provide required guidance to ensure smooth functioning of the
plant
Perform additional duties commensurate with the current role, as and when requested by management
Should have the experience in water treatment plant.","Analyse the electricity data and report to the management in order to manage the EMS system effectively and minimize unwanted expenses.","Full-time","Bachelor of Science (BSc) in EEE","Age 27 to 35 years","Chattogram","""jobTitle","category","companyName","vacancy","jobContext","jobDescription","employmentStatus","educationalReq","additionalReq","jobLocation","salary"
"Workshop Incharge","Engineer Architect","Intraco CNG Limited","2","We are looking for young and energetic workshop Incharge for our CNG Conversion workshop situated at Dhaka and Chittagong","Operation, monitor and overall Administrative work.","Full-time","B.Sc / Diploma in Automobile Engineering","Age 30 to 35 years","Anywhere in Bangladesh","Negotiable""jobTitle","category","companyName","vacancy","jobContext","jobDescription","employmentStatus","educationalReq","additionalReq","jobLocation","salary"
"Project Coordinator","Engineer Architect","Akij Steel Mills Ltd.","Not specific","We are seeking a highly organized and detail-oriented Project Coordinator to join our team. As a Project Coordinator, you will play a crucial role in supporting the successful execution and completion of pre-engineered steel building projects. You will work closely with the project team, including engineers, architects, contractors, and suppliers, to ensure effective coordination and communication throughout the project lifecycle. The ideal candidate should have strong project coordination skills and a background in the construction industry, preferably in the field of pre-engineered steel buildings and structures.","To be responsible for coordination of the different projects which includes site supervision, planning, managing, coordinating, evaluating, controlling & completing the project of Pre-Fabricated Structures timely by assuring ASML’s standard guide-line & quality.","Full-time","Bachelor of Science (BSc) in Civil Engineering","Age 26 to 34 years","Anywhere in Bangladesh","Negotiable""jobTitle","category","companyName","vacancy","jobContext","jobDescription","employmentStatus","educationalReq","additionalReq","jobLocation","salary"
"Manager - Maintenance (Mechanical) - Textile & Spinning","Engineer Architect","NASSA GROUP","Not specific","Maintenance Leadership: Lead and manage a team of maintenance technicians and engineers, providing guidance, training, and support to ensure high-quality maintenance work.
Equipment Maintenance: Develop and implement maintenance schedules, strategies, and procedures for all mechanical equipment used in the spinning process.
Troubleshooting: Quickly diagnose and resolve mechanical issues to minimize production downtime and ensure optimal equipment performance.
Preventive Maintenance: Establish and manage a preventive maintenance program to reduce the risk of equipment breakdowns and extend the lifespan of machinery.
Budget Management: Develop and manage the maintenance department budget, ensuring cost-effective operations while maintaining equipment reliability.
Safety Compliance: Ensure that all maintenance activities are carried out in compliance with safety regulations and best practices to create a safe working environment.
Documentation: Maintain accurate records of maintenance activities, equipment performance, and spare parts inventory.
Vendor Relations: Collaborate with suppliers and vendors to source spare parts, equipment, and services as needed.
Continuous Improvement: Identify opportunities for process improvement, cost reduction, and efficiency enhancement within the maintenance department.
Reporting: Provide regular reports and updates on equipment status, maintenance activities, and department performance to senior management.","Maintenance Leadership: Lead and manage a team of maintenance technicians and engineers, providing guidance, training, and support to ensure high-quality maintenance work.","Full-time","A Bachelor's degree (B.Sc) in Mechanical Engineering from a reputable public university.","Age 30 to 45 years","Anywhere in Bangladesh","Negotiable""jobTitle","category","companyName","vacancy","jobContext","jobDescription","employmentStatus","educationalReq","additionalReq","jobLocation","salary"
"Senior Officer, Research & Innovation","Engineer Architect","Walton Digi-Tech Industries Ltd.","1","The R&I Associate will work under the supervision of senior R&D staff and assist in the design, development, and testing of new products or processes. The incumbent will be responsible for carrying out experiments, analyzing data, and contributing to technical reports","Fully Dedicated for Product Analysis, Testing and Reporting, BOM support, Service-related SOP.","Full-time","Diploma in Electronics","Age at least 24 years","Gazipur (Kaliakair)","Tk. 15000 - 25000 (Monthly)""jobTitle","category","companyName","vacancy","jobContext","jobDescription","employmentStatus","educationalReq","additionalReq","jobLocation","salary"
"Maintenance Engineer","Engineer Architect","LMT Transport","Not specific","LMT CO. is a leading construction company in Bangladesh, with a wide range of projects underway. We are looking for a highly skilled and experienced Heavy Equipment and Vehicle Maintenance Engineer to join our team.",".The successful candidate will be responsible for the following:","Full-time","Bachelor degree in any discipline","Age at least 18 years","Chattogram","""jobTitle","category","companyName","vacancy","jobContext","jobDescription","employmentStatus","educationalReq","additionalReq","jobLocation","salary"
"Sub Assistant Engineer","Engineer Architect","BADHON GROUP","Not specific","Assist in planning, managing and executing production / QC process.To ensure implementation of daily production requirement / QC issues.To ensure quality of the products as per set-standard.To prepare daily production report and submit to Shift In-Charge.To ensure safety and security of production floor.To ensure resolving technical problem during production with the direction of the supervisor.To ensure proper use of raw materials in the production process.Any others tasks assigned by the management from time to time.","Assist in planning, managing and executing production / QC process.","Full-time","Diploma in Engineering in Electrical, Electronics & Computer.","Age 18 to 35 years","Dhaka (Keraniganj)","Tk. 12000 - 20000 (Monthly)""jobTitle","category","companyName","vacancy","jobContext","jobDescription","employmentStatus","educationalReq","additionalReq","jobLocation","salary"
"Calibration Engineer/ Inspection Engineer","Engineer Architect","Standard Calibration Service Pvt Ltd","Not specific","The Inspection Engineer will have a pivotal role in leading the Quality culture whilst ensuring compliance to ISO/IEC 17020, FSR Code of Practice, information security and environmental requirements. also same 17025","Perform accurate calibrations","Full-time","At least 1 year(s)","Age at least 20 years","Dhaka","Negotiable""jobTitle","category","companyName","vacancy","jobContext","jobDescription","employmentStatus","educationalReq","additionalReq","jobLocation","salary"
"Assistant Manager / Deputy Manager","Engineer Architect","BADHON GROUP","Not specific","Responsible for Tender Marketing and monitoring the bid management in order to ensure it is aligned with the organization's requirements and Coordination of tender reviews and deadlines and adjust them to the frameworks given by the clients (Government Electric utilities such as BREB, BPDB, NESCO, DESCO etc.)
Responsible of checking various Tender Search systems daily on online & newspaper and identify to bid purposes and maintain all the Tender purchase issue and maintaining all the upcoming tender list in excel sheet and collecting the APP on daily basis.
Responsible for Prepare and maintain all the Tender and e-Tender related Paper for Tender Submission in Government Electric Utilities( BREB,PDB,DESCO,NESCO etc) and review of information about demands and derivation of supply and follow up the relevant procedures for Tender compilation, authorization and dispatch.
Responsible for Prepare and maintain all the Tender related Paper with specific Document after tender execution. (NOA Acceptance, PG & Contract Agreement, Inspection Call & report Preparation, Bid Validity & Security Extension) and Connect with logistics team to update Dispatch order & track Vehicle Information.
Responsible for maintaining and follow up all the RR, Challan after goods delivery of the Tender effectively and efficiently for billing purposes and ensure timely receivable collection.
Responsible for maintaining overview of all running Tender (Which includes Tender Present Condition such as TEC, Sample Test, Board Meeting & Ministry Approval & undelivered goods ) and communicate with assigned people through email, mobile for all tender status.
Responsible for maintaining and collecting all the results according to Tender Pkg. & Sub-Packages with specific goods in separate excel sheet.
Responsible for Liaison/communication with the officials of the different organization and foreign Companies for execution of assigned job and develop and research new products as per the need of the market and Identify market opportunities & forecast business ventures.
Must have the mentality to visit all the Government Electric Utilities on regular basis.","Responsible for Tender Marketing and monitoring the bid management in order to ensure it is aligned with the organization's requirements and Coordination of tender reviews and deadlines and adjust them to the frameworks given by the clients (Government Electric utilities such as BREB, BPDB, NESCO, DESCO etc.)","Full-time","Bachelor of Science (BSc) in EEE, CSE, ECE, ME in any discipline","Age 20 to 40 years","Dhaka","Negotiable""jobTitle","category","companyName","vacancy","jobContext","jobDescription","employmentStatus","educationalReq","additionalReq","jobLocation","salary"
"Head of Research & Innovation","Engineer Architect","Walton Digi-Tech Industries Ltd.","1","Walton Digi-Tech Industries Ltd. is a leading tech innovator dedicated to pushing the boundaries of technology. We are seeking a dynamic and visionary leader to helm our Research & Innovation department.","Provide visionary leadership and strategic direction to the Research & Innovation team, aligning efforts with the company's goals and objectives.","Full-time","Bachelor's degree in Engineering (preferable EEE/CSE/IPE/ME); Master's degree will be an added advantage.","Age at least 28 years","Gazipur (Kaliakair)","Negotiable""jobTitle","category","companyName","vacancy","jobContext","jobDescription","employmentStatus","educationalReq","additionalReq","jobLocation","salary"
"Engineer Planning","Engineer Architect","SS Rahman International Ltd","Not specific","He should have the ability to Plan new civil related work including related calculation and structural design formulation.
He should have the capability to understand structural drawings related all issues.
He should be able to function as Project Coordinator for Civil Works.
He should have the capability to understand BOQ, Working drawings, technical specifications and contract document.
He should have the capability to do physical measurements of various civil related works.
He should be skilled in computer aided jobs using MS Excel, MS Words, MS Power Point and AUTO CAD.
He should be able to prepare PPT presentation for day to day requirement.","He should have the ability to Plan new civil related work including related calculation and structural design formulation.","Full-time","Must be BSc in Civil Engineering from reputed Public/Private University.","","Anywhere in Bangladesh","Negotiable""jobTitle","category","companyName","vacancy","jobContext","jobDescription","employmentStatus","educationalReq","additionalReq","jobLocation","salary"
"PCB Designer","Engineer Architect","Walton Digi-Tech Industries Ltd.","2","Walton Digitech Industries Ltd. is a pioneering technology company dedicated to designing and manufacturing cutting-edge electronics for various industries. With a strong emphasis on innovation, we are committed to delivering high-quality IT products to our clients.","Collaborate closely with the engineering team to transform product requirements into detailed schematic diagrams for IT components.","Full-time","Bachelor's degree in Electrical Engineering, or a related field","Age at least 25 years","Gazipur (Kaliakair)","Tk. 50000 - 70000 (Monthly)""jobTitle","category","companyName","vacancy","jobContext","jobDescription","employmentStatus","educationalReq","additionalReq","jobLocation","salary"
"Sr. Sales Officer/ Area Sales Manager, Marketing & Sales (Oriental Power and OG Elevator)","Engineer Architect","Oriental Power","Not specific","Oriental Power is a sister concern of Oriental Group. It represents Lift & Generator of a significant brand IFE & AIRMAN (Japanese), Only Sole distributor in Bangladesh. 
Oriental Power is looking some energetic, honest, hard working & dedicated Sr. Sales Officer/ Area Sales Manager who has good leadership skills and able to create an innovative sales team and new markets.
Candidates with proven track records in the area of Marketing and Sales specifically selling Generators and Elevators, and those who are fully confident, that they have the required strategy, skills, experience to deal with International Brands like AIRMAN Generator and IFE Elevators are highly encouraged to apply.","Oriental Power is a sister concern of Oriental Group. It represents Lift & Generator of a significant brand IFE & AIRMAN (Japanese), Only Sole distributor in Bangladesh.","Full-time","At least Graduation from any recognized Institute/ University.","Age 20 to 40 years","Chattogram, Cumilla, Dhaka, Khulna","Negotiable""jobTitle","category","companyName","vacancy","jobContext","jobDescription","employmentStatus","educationalReq","additionalReq","jobLocation","salary"
"Quantity Engineer (Civil)","Engineer Architect","Neezer Bari Design & Construction","Not specific","We are seeking a skilled and experienced Quantity Engineer (Civil) to join our dynamic team. As a Quantity Engineer, you will play a pivotal role in ensuring the highest standards of quality and safety in our construction projects. Your expertise in Civil Engineering and proficiency in AutoCAD will be critical in maintaining our commitment to excellence. If you are passionate about delivering quality results in the construction industry and have a keen eye for detail, this is the perfect opportunity for you to contribute to our continued success.","We are seeking a skilled and experienced Quantity Engineer (Civil) to join our dynamic team. As a Quantity Engineer, you will play a pivotal role in ensuring the highest standards of quality and safety in our construction projects. Your expertise in Civil Engineering and proficiency in AutoCAD will be critical in maintaining our commitment to excellence. If you are passionate about delivering quality results in the construction industry and have a keen eye for detail, this is the perfect opportunity for you to contribute to our continued success.","Full-time","Diploma in Civil","Age at least 20 years","Dhaka (Lalmatia)","Tk. 12000 - 14000 (Monthly)""jobTitle","category","companyName","vacancy","jobContext","jobDescription","employmentStatus","educationalReq","additionalReq","jobLocation","salary"
"MEP Engineer","Engineer Architect","Industrial Park","1","Manage to oversee the work of subordinate Engineers and departmental staff.
Prepare plans, specifications and costing of utilities 
Follow-up any machine installations and maintenance schedules of existing machines.
Analyze mechanical, Electrical, and Plumbing engineering problems and formulate solutions.
Assign and followup the the day-to-day work of the MEP team.","Manage to oversee the work of subordinate Engineers and departmental staff.","Full-time","Bachelor of Science (BSc) in Civil Engineering, Bachelor of Science (BSc) in Electrical & Electronic Engineering, Bachelor of Science (BSc) in Mechanical Engineering","Age at least 30 years","Anywhere in Bangladesh","Negotiable""jobTitle","category","companyName","vacancy","jobContext","jobDescription","employmentStatus","educationalReq","additionalReq","jobLocation","salary"
"AutoCAD Architect","Engineer Architect","Bright River Bangladesh Ltd.","5","Any candidate with expertise on AutoCad can apply for this position.
As we have to run our office 24/7 and 365 days a, We have to maintain 3 shifts 
(8 Hours) Morning, Evening, and Night shifts, therefore, you may have to rotate between shifts including Night shift.","Any candidate with expertise on AutoCad can apply for this position.","Full-time","Diploma in Engineering in Architecture, Bachelor of Science (BSc) in Civil Engineering","Age 25 to 35 years","Dhaka","NegotiableMedical Insurance 
Festival Bonus
Over Time
Night Allowances""jobTitle","category","companyName","vacancy","jobContext","jobDescription","employmentStatus","educationalReq","additionalReq","jobLocation","salary"
"Product Manager (Access Control)","Engineer Architect","Walton Digi-Tech Industries Ltd.","1","Walton DigiTech Industries Ltd. is a prominent tech manufacturer, dedicated to producing cutting-edge Access Control Devices. Under the Product Management department, we specialize in the production of advanced security solutions.","Define the strategic direction for the Access Control devices category, aligning it with market trends and customer security needs.","Full-time","Bachelor's degree in engineering, or a related field. MBA preferred.","Age at least 25 years","Gazipur (Kaliakair)","Tk. 40000 - 60000 (Monthly)""jobTitle","category","companyName","vacancy","jobContext","jobDescription","employmentStatus","educationalReq","additionalReq","jobLocation","salary"
"Product Manager (Display, UPS)","Engineer Architect","Walton Digi-Tech Industries Ltd.","1","Walton DigiTech Industries Ltd. is a prominent tech manufacturer, dedicated to producing high-quality Displays (such as Monitors and Interactive Displays) and Uninterruptible Power Supplies (UPS). Under the Product Management department, we specialize in providing cutting-edge visual solutions and power management devices","Define the strategic direction for the Displays and UPS category, aligning it with market trends and customer needs.","Full-time","Bachelor's degree in Engineering, or a related field. MBA preferred.","Age at least 25 years","Gazipur (Kaliakair)","Tk. 40000 - 60000 (Monthly)""jobTitle","category","companyName","vacancy","jobContext","jobDescription","employmentStatus","educationalReq","additionalReq","jobLocation","salary"
