"jobTitle","category","companyName","vacancy","jobContext","jobDescription","employmentStatus","educationalReq","additionalReq","jobLocation","salary"
"General Manager (Land & Estate)","Law Legal","Maxwell Homes & Properties Limited","Not specific","A Reputed Group of Companies is looking for ""GM Legal & Land"". Legal & Land will report to Head of Legal & Land of the organization.
Head of Legal & Land
The GM, Legal & Land will report to the Head of Legal & Land of the organization. The incumbent will be responsible to manage all legal & land functions, provide legal advice as & when required. In this context, we need responsible, dedicated, self-motivated, and proactive professional who has experience to handle legal & land activities in a large renowned organization.","A Reputed Group of Companies is looking for ""GM Legal & Land"". Legal & Land will report to Head of Legal & Land of the organization.","Full-time","Skills Required: Legal Estate","Age at least 40 years","Dhaka","Negotiable""jobTitle","category","companyName","vacancy","jobContext","jobDescription","employmentStatus","educationalReq","additionalReq","jobLocation","salary"
"Sr. Executive / Assistant Manager (Land & Logistics)","Law Legal","Nawar Properties Ltd.","Not specific","Nawar Properties Limited (NPL) is one of the promising Real Estate Companies with the vision of developing the present Real Estate sector in Bangladesh looking for Sr. Executive /Assistant Manager (Land & Logistics) to add value and improve our operations by bringing a systematic and disciplined approach to the effectiveness of accounting & financial process. The successful candidate will possess a thorough knowledge of Land & Logistics and a sound judgement on financial activities.","Coordinate and Liaison with RAJUK for Timely Drawing, Design Approval.","Full-time","Bachelor of Law (LLB) in L.L.M","Age at least 25 years","Anywhere in Bangladesh","Negotiable""jobTitle","category","companyName","vacancy","jobContext","jobDescription","employmentStatus","educationalReq","additionalReq","jobLocation","salary"
"Lecturer/Assistant Professor ( Department of Law)","Law Legal","State University of Bangladesh (SUB)","Not specific","Teaching and Research.","","Full-time","Master of Law (LLM)","Age at least 26 years","Dhaka","As per University Rules.""jobTitle","category","companyName","vacancy","jobContext","jobDescription","employmentStatus","educationalReq","additionalReq","jobLocation","salary"
"Company Secretary","Law Legal","Golden Harvest Group","01","Responsible for secretarial function of Golden Harvest Group.Advise the board and management committees on all statutory and constitutional requirements to ensure that business is conducted in proper and effective manner.","Responsible for secretarial function of Golden Harvest Group.","Full-time","Masters degree in any discipline, Master of Law (LLM)","Age at least 30 years","Dhaka","Negotiable""jobTitle","category","companyName","vacancy","jobContext","jobDescription","employmentStatus","educationalReq","additionalReq","jobLocation","salary"
"Executive - Investigation","Law Legal","Walton Plaza.","2","We are seeking a highly skilled and experienced Executive - Investigation to join our team. As a key member of our organization, you will be responsible for investigating and preventing any type of corporate or white-collar crimes, fraudulent claims, and any irregularities that may impact the smooth operations of our company.","Investigate and prevent any type of corporate or white-collar crime within or against the company.","Full-time","BSc (Hons.) in Criminology & Police Science / BSS (Hons.) in Criminology","Age 24 to 30 years","Dhaka","Negotiable""jobTitle","category","companyName","vacancy","jobContext","jobDescription","employmentStatus","educationalReq","additionalReq","jobLocation","salary"
"Legal Manager","Law Legal","International Rescue Committee (IRC)","Not specific","Department: Protection and Rule of Law (PRoL)
Contract length: Till 24 July 2024 (with possibility of extension subject to funding, program needs and performance of incumbent)
Work Location: IRC-Bangladesh, Ukhiya Office
Reporting to: PRoL Coordinator
Expected Start Date: At Earliest
Purpose: The Legal Manager will be responsible for provision of technical guidance and oversight of the legal services component of IRC`s PROL programming across the camp and Host community. This will include leadership of internal and external legal capacity building activities, and the identification and analysis of legal trends and issues of concern. S/he will also be in charge of ensuring coordination with IRC Partner in Host community. The Legal Manager will undertake coordination with other legal actors at camp and host community, as well as supporting local-level coordination with legal actors, as needed.","Department: Protection and Rule of Law (PRoL)","Contractual","Bachelor of Laws (LLB)/ Master of Laws (LLM)","At least five (5) years of prior professional experience as a practicing lawyer or in a position where legal advice, counseling and assistance was frequently provided to vulnerable clients.","Cox's Bazar (Ukhia)","Competitive Base Pay with Fringe Benefits (As per IRC National Pay Scale in Bangladesh)""jobTitle","category","companyName","vacancy","jobContext","jobDescription","employmentStatus","educationalReq","additionalReq","jobLocation","salary"
"Associate (Documentation)","Law Legal","BLACK AND WHITE LAW HOUSE","3","BLACK AND WHITE LAW HOUSE is one of the renowned law chambers of the country. It consists of both young law professionals and experienced experts. It is the first ever law house in Bangladesh aiming at facilitating all kinds of legal services from a single network while focusing on documentation and litigation of Civil, Commercial and Corporate issues and legal research. However, it also deals with arbitration, commercial dispute resolution, consultancy, business related counseling, problem solving through counseling or mediation or compromise. We maintain utmost sincerity, honesty and accountability with our clients and we expect thesame from our associates.","Preparing documentation, deeds/agreements, vetting land documents, legal opinions, and other legal documents.","Full-time","Master of Law (LLM)","Age 22 to 35 years","Dhaka (Elephant Road, Kakrail, Paltan)","Tk. 15000 (Monthly)"