"jobTitle","category","companyName","vacancy","jobContext","jobDescription","employmentStatus","educationalReq","additionalReq","jobLocation","salary"
"Digital Marketing Executive (Female)","Marketing Sales","M/S Kamal International  (RL – 713)","01","We are looking for hiring an experienced in Digital Marketing to develop our organization on social platform. In this position, the candidate will be involved in developing digital marketing strategies, implementing digital marketing plans, and creative planning and execution of all the digital marketing campaigns, including good Computer knowledge & Graphics Designing Knowledge , writing content besides SEO. And who has excellent written and verbal communication skills both in Bengali & English.","Expertise on Social Media platforms marketing, Facebook, Instagram, LinkedIn, SEO, Google Ads, manage digital marketing campaigns, and YouTube marketing.","Full-time","Bachelor degree in any discipline","Age 20 to 28 years","Dhaka","NegotiableSalary increment is based upon the performance of the employee of the organization.""jobTitle","category","companyName","vacancy","jobContext","jobDescription","employmentStatus","educationalReq","additionalReq","jobLocation","salary"
"AGM/ DGM, Sales & Marketing (Jute)","Marketing Sales","A well reputed Jute Compnay","02","Oversee all aspects of several client accounts, including all communication and interaction, placing orders and making sales.Emphasizes product features based on customers' needs.Manages the sales cycle from inception to execution.Maintained a very close communication for 24/7 with the factory to fulfill requests on a daily basis to ensure client satisfaction at all times.Keep records of all sales information in efficient and concise sales reports.Follow up and maintain commercial reports related to Export activities and inform management as required.Any other job assign time to time by the management.","Oversee all aspects of several client accounts, including all communication and interaction, placing orders and making sales.","Full-time","Bachelor degree in any discipline","Age at least 35 years","Dhaka","Negotiable""jobTitle","category","companyName","vacancy","jobContext","jobDescription","employmentStatus","educationalReq","additionalReq","jobLocation","salary"
"Marketing & Sales Executive","Marketing Sales","DoDoBazar.com","Not specific","We are looking for a skilled Marketing & Sales Executive to join our team.","We are looking for a skilled Marketing & Sales Executive to join our team.","Full-time","Bachelor's degree in any discipline","Age 22 to 40 years","Dhaka","Negotiable""jobTitle","category","companyName","vacancy","jobContext","jobDescription","employmentStatus","educationalReq","additionalReq","jobLocation","salary"
"Executive - Marketing & Sales","Marketing Sales","N S Surgical","10","We are looking for Marketing & Sales Executive of medical device in wholesales/retails and hospital market. Interested candidates should have knowledge to sales Blood glucose meter.
Job Location: Dhaka / Anywhere in Bangladesh","We are looking for Marketing & Sales Executive of medical device in wholesales/retails and hospital market. Interested candidates should have knowledge to sales Blood glucose meter.","Full-time","Bachelor degree in any discipline","Age 22 to 35 years","Anywhere in Bangladesh","Negotiable""jobTitle","category","companyName","vacancy","jobContext","jobDescription","employmentStatus","educationalReq","additionalReq","jobLocation","salary"
"Digital Marketing Executive (Male)","Marketing Sales","Irani Borka Bazar Ltd (Irani Borka Bazar Ltd, Six Life Style, Designer Mega Mall)","1","Designer Lifestyle Ltd. (Clothing Brand) is looking to hire an experienced Digital Marketing Expert to help drive the company’s online/digital sales and Branding/Marketing. In this position, the candidate will be involved in developing digital marketing strategies, implementing digital marketing & sales plans, and creative planning and execution of all the digital marketing campaigns, including good knowledge of Graphics Design and marketing areas. writing content besides SEO.","Implementing and Managing the Company's social media accounts. Expertise in Social Media platforms Facebook (pages & groups), Instagram, Google, YouTube, etc. to manage digital marketing campaigns, develop relevant content, publish in digital channels, and regularly maintain the channels (social media, web, etc.) to reach the company's target customers.","Full-time","HSC","Age 22 to 30 years","Dhaka","Negotiable""jobTitle","category","companyName","vacancy","jobContext","jobDescription","employmentStatus","educationalReq","additionalReq","jobLocation","salary"
"ডি.এস.আর","Marketing Sales","এফ.এম এন্টারপ্রাইজ","30","ঐতিহ্যবাহী বগুড়ার দই, ক্ষীরসা ও ঘি বাজারজাত করনের লক্ষ্যে ঢাকা, কুমিল্লা, চট্টগ্রাম, কক্সবাজার, খাগড়াছড়ি, বান্দরবান, গাজিপুর ও ময়মনসিংহ জেলায় কাজ করতে আগ্রহী বাংলাদেশের বিভিন্ন জেলার প্রার্থীদের নিকট থেকে নিম্নে উল্লেখিত শর্তে চাকুরীর আবেদন আহ্বান করা হচ্ছে।","","Full-time","এস.এস.সি/ সমমান","Age 18 to 45 years","কক্সবাজার, কুমিল্লা, খাগড়াছড়ি, গাজীপুর, চট্টগ্রাম, ঢাকা, বান্দরবান, ময়মনসিংহ","শিক্ষানবিসকাল প্রথম ১ মাস কমিশন ২০%
স্থায়ীকরনের পর দৈনিক বিক্রয় টার্গেট ৬০০০/- (ছয় হাজার) টাকা।
স্থায়ীকরনের পর সর্বসাকুল্যে বেতন ২০,০০০/- (বিশ হাজার) টাকা।""jobTitle","category","companyName","vacancy","jobContext","jobDescription","employmentStatus","educationalReq","additionalReq","jobLocation","salary"
"Manager (Sales)","Marketing Sales","Akij Steel Mill Ltd.","Not specific","The Manager (Sales) is responsible for leading and managing the sales team to achieve revenue targets, develop new business opportunities, and maintain strong customer relationships. He will develop and implement sales strategies, oversee the sales process, and collaborate with other departments to ensure customer satisfaction and project success.","Develop and implement strategic sales plans to achieve company objectives.","Full-time","Bachelor of Science (BSc) in Civil Engineering, Master of Business Administration (MBA) in Marketing","Age at least 38 years","Dhaka","Negotiable""jobTitle","category","companyName","vacancy","jobContext","jobDescription","employmentStatus","educationalReq","additionalReq","jobLocation","salary"
"Assistant Manager - Sales (Bran Oil)","Marketing Sales","Abdul Monem Limited","Not specific","Permanent: After successful probation period","Selling rice bran oil (crude/refinery), byproducts (die-oiled rice bran), scrap items (sacks and others).","Full-time","Bachelor degree in any discipline, Masters degree in any discipline","Age 32 to 40 years","Anywhere in Bangladesh","NegotiableAs per company policy""jobTitle","category","companyName","vacancy","jobContext","jobDescription","employmentStatus","educationalReq","additionalReq","jobLocation","salary"
"Area Sales Manager","Marketing Sales","Akij Match Factory Ltd.","Not specific","Akij Match Factory Ltd., an unit of Akij group, is seeking for Area Sales Manager with at least 5 years experience as ASM in the relevant field.","Setting sales targets for individual territory and zone","Full-time","Bachelor of Commerce (Pass)","Age 32 to 35 years","Anywhere in Bangladesh","Negotiable""jobTitle","category","companyName","vacancy","jobContext","jobDescription","employmentStatus","educationalReq","additionalReq","jobLocation","salary"
"Sales In-charge (Adhesive)","Marketing Sales","Redmin Industries Limited","Not specific","Adhesive Sales & Marketing","Monitoring Adhesive Sales Team specially stick glue;","Full-time","Bachelor of Business Administration (BBA) in Marketing","Age at most 35 years","Anywhere in Bangladesh","Negotiable""jobTitle","category","companyName","vacancy","jobContext","jobDescription","employmentStatus","educationalReq","additionalReq","jobLocation","salary"
"Digital Marketing (Senior Executive)","Marketing Sales","Three A industries limited","3","Expert in Facebook marketing and management. 
Expert in Instagram marketing and management . 
work experience in local market. 
clear idea about digital customer behavior. 
Data analysis for re-targeting . 
Prepare boosting copy. 
Market analysis for  hygiene and beauty product. 
Work for organic growth.","Expert in Facebook marketing and management.","Full-time","Bachelor degree in any discipline","Age 23 to 32 years","Dhaka (Uttara)","Tk. 22000 - 35000 (Monthly)""jobTitle","category","companyName","vacancy","jobContext","jobDescription","employmentStatus","educationalReq","additionalReq","jobLocation","salary"
"B2B Lead Generation Manager (Online Sales)","Marketing Sales","XPONENT InfoSystem (Pvt.) Ltd.","5","We are seeking a strategic and tactical B2B Lead Generation Manager with a focus on online sales. This role entails creating and refining Ideal Customer Profiles (ICP), Buyer Personas, prospecting via various platforms, including LinkedIn and other data sources, qualifying prospects, running campaigns, performing A/B testing, fine-tuning strategies, and scaling up successful approaches.We value talent and are committed to nurturing and developing it. If you are a talented graduate with exceptional English language skills, a quick learner, and possess high caliber, we are open to providing necessary training to enhance your capabilities and help you succeed in this role.","We are seeking a strategic and tactical B2B Lead Generation Manager with a focus on online sales. This role entails creating and refining Ideal Customer Profiles (ICP), Buyer Personas, prospecting via various platforms, including LinkedIn and other data sources, qualifying prospects, running campaigns, performing A/B testing, fine-tuning strategies, and scaling up successful approaches.","Full-time","Masters degree in any discipline","Age at most 40 years","Chattogram, Chattogram (Double Mooring)","NegotiableThe actual salary will be determined based on the candidate`s experience, qualifications, and negotiation during the hiring process.""jobTitle","category","companyName","vacancy","jobContext","jobDescription","employmentStatus","educationalReq","additionalReq","jobLocation","salary"
"Executive/ Sr. Executive - Sales & Marketing (Fish Feed)","Marketing Sales","Khan Agro Feed Products (Sister Concern Khan Agro Group)","Not specific","Khan Agro Feed Products is a prominent name in the Agro Feed Industry sector of Bangladesh since 1986. We are looking for some energetic, industrious candidates for the above-mentioning post of Manha Fish Feed a sister concern of Khan Agro Group.","Achieve sales target of the assigned area.","Full-time","Masters from a leading Institute/University.","Minimum 01 to 02 years' experience in any reputed Fish Feed Industries.","Anywhere in Bangladesh","Negotiable""jobTitle","category","companyName","vacancy","jobContext","jobDescription","employmentStatus","educationalReq","additionalReq","jobLocation","salary"
"Officers International Marketing","Marketing Sales","Stitches Limited","10","Full time job based on Head Office at Dhaka/ Factory located at Gazipur.","Managing Alibaba sub-account.","Full-time","Bachelor of Business Administration (BBA)","Age 20 to 35 years","Anywhere in Bangladesh","Negotiable""jobTitle","category","companyName","vacancy","jobContext","jobDescription","employmentStatus","educationalReq","additionalReq","jobLocation","salary"
"Digital Marketing Manager","Marketing Sales","M/S Kamal International  (RL – 713)","01","We are looking to hire an experienced digital Marketing specialist. The candidate will be responsible for creating digital marketing strategies, putting digital marketing & sales plans into action, and creatively planning and executing all of the digital marketing campaigns, which will require strong graphics design and marketing skills.","Taking care of the company's social media accounts on sites like Facebook (pages & groups), Instagram, Google, YouTube, & LinkedIn in order to manage digital marketing campaigns, create pertinent content, publish in digital channels, and regularly update the channels (social media, website, etc.) in order to connect with the company's target audience.","Full-time","5 to 7 year(s)","Age 23 to 30 years","Dhaka","Negotiable""jobTitle","category","companyName","vacancy","jobContext","jobDescription","employmentStatus","educationalReq","additionalReq","jobLocation","salary"
"Executive/ Sr. Executive, Brand Communication","Marketing Sales","Barovoot Limited","04","Barovoot is an attention-seeking soul! It`s an integrated marketing communication agency with some dedicated souls who are passionate about branding, advertising, digital marketing, content creation, storytelling and filming. Barovoot innovate, communicate and inspire people to live better lives. It has been serving the industry since 2011 with some proven work.Barovoot Limited is looking for an experienced person for the position of Executive/ Sr. Executive in its Brand Communication Team.","Barovoot is an attention-seeking soul! It`s an integrated marketing communication agency with some dedicated souls who are passionate about branding, advertising, digital marketing, content creation, storytelling and filming. Barovoot innovate, communicate and inspire people to live better lives. It has been serving the industry since 2011 with some proven work.","Full-time","BBA/ MBA","Age 20 to 30 years","Dhaka (Gulistan)","NegotiableMarket standard salary package.""jobTitle","category","companyName","vacancy","jobContext","jobDescription","employmentStatus","educationalReq","additionalReq","jobLocation","salary"
"Engineer (Sales)","Marketing Sales","Akij Steel Mills Ltd.","Not specific","We are seeking an Engineer (Sales) with expertise in Pre-Engineered Steel Buildings & Structures to join our team. As an Engineer (Sales), you will be responsible for driving sales growth, providing technical solutions to clients, and supporting the sales team. Your primary focus will be on understanding customer needs, offering tailored solutions, and ensuring customer satisfaction throughout the sales process.","Provide technical expertise and support to clients, architects, engineers, and contractors in the pre-engineered steel buildings and structures industry.","Full-time","Bachelor of Science (BSc) in Civil Engineering, Master of Business Administration (MBA) in Marketing","Age 26 to 32 years","Anywhere in Bangladesh","Negotiable""jobTitle","category","companyName","vacancy","jobContext","jobDescription","employmentStatus","educationalReq","additionalReq","jobLocation","salary"
"Customer Service Officer- S&B Sales (Marketing)","Marketing Sales","YKK Bangladesh Pte Ltd.","01","Promotional tools preparation(Catalogue, Sample etc, Exhibition preparation)Prepare daily/monthly sales report with analysis.Monthly business data preparation and submit requested buyer.Product development and factory communication for development.Communication with global team/sister company as per necessity.Collaborate with sales/marketing team for daily follow up.Any other task assign by the department manager.","Promotional tools preparation(Catalogue, Sample etc, Exhibition preparation)","Full-time","Honors/BBA From Reputed University","Age at most 33 years","Dhaka",""