"jobTitle","category","companyName","vacancy","jobContext","jobDescription","employmentStatus","educationalReq","additionalReq","jobLocation","salary"
"Manager, R&D (Solar Cell & Energy Generation)","Research Consultancy","East Coast Group","1","Work with internal & external stakeholders to identify and refine needs, formulate system requirements and develop method as per application in Solar PV module/ Renewable energy business.
Support in Technology roadmap for development of next generation products in PV Solar Module to support both off grid and on grid requirements.
Execute the new innovation of energy efficiency and application of converter typologies.
Lead the solar PV module design, component layout, prototype build up and subsequent verification, setup parameter for accessories & sourcing of equipment's and validation through testing in the R&D laboratories and develop requirements as per certification body.","Work with internal & external stakeholders to identify and refine needs, formulate system requirements and develop method as per application in Solar PV module/ Renewable energy business.","Full-time","Minimum B.Sc in EEE from reputed institution.","Age at least 33 years","Dhaka (Ashulia)","""jobTitle","category","companyName","vacancy","jobContext","jobDescription","employmentStatus","educationalReq","additionalReq","jobLocation","salary"
"Asst. Manager/ Deputy Manager (R&D- Structure & Design)","Research Consultancy","East Coast Group","1","Work with internal and external stakeholders to identify and refine needs, formulate system requirements and develop method as per application in Solar PV module/ Renewable Energy Business.
Design and Validate for development of next generation products in PV Solar Module to support both off grid and on grid requirements.
Develop new designs to minimize cost as per the requirement of Energy generation efficiency and international certification body.
Proper simulation of developed design per real time application.","Work with internal and external stakeholders to identify and refine needs, formulate system requirements and develop method as per application in Solar PV module/ Renewable Energy Business.","Full-time","Minimum B.Sc In EEE/ ME from reputed institution.","Age at least 30 years","Dhaka (Ashulia)","""jobTitle","category","companyName","vacancy","jobContext","jobDescription","employmentStatus","educationalReq","additionalReq","jobLocation","salary"
"Executive Director, Direct Tax","Research Consultancy","PricewaterhouseCoopers Bangladesh Private Limited","Not specific","PwC provides professional services, including audit and assurance, tax and consulting, covering such areas as cybersecurity and privacy, human resources, deals, and forensics to clients in Bangladesh. We are hiring an Executive Director, Direct Tax to join the team in Dhaka.
We are seeking an Executive Director to lead the strategic growth of our Direct Tax practice, driving client relationships, business development, and compliance engagements.","PwC provides professional services, including audit and assurance, tax and consulting, covering such areas as cybersecurity and privacy, human resources, deals, and forensics to clients in Bangladesh. We are hiring an Executive Director, Direct Tax to join the team in Dhaka.","Full-time","Bachelor of Business Administration (BBA) in Finance","Age at most 60 years","Anywhere in Bangladesh","NegotiableUSD 94,700 - USD 98,400 (Annually)""jobTitle","category","companyName","vacancy","jobContext","jobDescription","employmentStatus","educationalReq","additionalReq","jobLocation","salary"
"Senior Officer, Canada Immigration Program","Research Consultancy","Global Citizen Education Inc.","5","GCEI is one of the leading educational consultancy firms in Bangladesh serving since 2017 of excellence in services and trust. We are looking for dynamic and motivated individuals to join our team.We are looking for a dedicated, compassionate Sr. Officer/Officer to join our visa application department. The responsibilities of the Sr. Officer/Officer will process the visa applications, maintain affiliation with stakeholders, keep track of new and updated knowledge of the specific country and their visa requirements, and deliver assigned tasks timely. The job also includes supporting the emotional and professional growth of applicants, developing and monitoring counseling support programs, and providing educational and vocational guidance.To complete the process successfully, you should treat each individual with patience and compassion for the challenges they are facing. Ultimately, a top-notch Sr. Officer/Officer has a strong level of reviewing documents, detailed study of each application, and coordinating with other professionals to get more outcomes.","GCEI is one of the leading educational consultancy firms in Bangladesh serving since 2017 of excellence in services and trust. We are looking for dynamic and motivated individuals to join our team.","Full-time","Bachelor degree in any discipline","Age 25 to 40 years","Dhaka (Banani)","NegotiableOn-time salary disbursement""jobTitle","category","companyName","vacancy","jobContext","jobDescription","employmentStatus","educationalReq","additionalReq","jobLocation","salary"
"Market Research & Analytics Deputy Manager/ Manager","Research Consultancy","Fiber @ Home Ltd.","Not specific","Design and execute comprehensive market research initiatives, including competitor analysis, customer segmentation, trend forecasting, and demand analysis.
Lead, mentor, and manage a team of market researchers and analysts also measuring their performance
Utilize various research methodologies, both qualitative and quantitative, to gather actionable insights and present findings
Collaborate cross-functionally with product development, marketing, sales, and other teams to align research findings with business objectives and product strategies.
Monitor industry trends, technological advancements, and competitive scenery to identify potential opportunities and threats.
Drive the development of innovative price concepts by applying insights from market research, ensuring alignment with customer preferences and needs.
Analyze the effectiveness of marketing, communication programs, and strategies
Improve existing business case methods or develop new concepts and their formulation
Stay up-to-date with emerging research methodologies, tools, and technologies to continuously improve the effectiveness and efficiency of the market research process.
Conducting in-depth market analysis, identifying emerging trends, and explaining insights into actionable strategies
Analyzing ""New products"" for marketing to target customers and formulate new budgets
Prepare and present regular reports and presentations to top management, summarizing key findings, recommendations, and potential market entry strategies.","Design and execute comprehensive market research initiatives, including competitor analysis, customer segmentation, trend forecasting, and demand analysis.","Full-time","Master of Business Administration (MBA) in Finance, Marketing, Bachelor of Business Administration (BBA) in Finance, Marketing","Age 29 to 37 years","Dhaka (GULSHAN 1)","Negotiable""jobTitle","category","companyName","vacancy","jobContext","jobDescription","employmentStatus","educationalReq","additionalReq","jobLocation","salary"
"Senior Counselor","Research Consultancy","UniGlobe Consulting","3","Giving all the required information to Clients.
Resolving client queries and problems.
Managing and guiding junior consultants. 
Conducting surveys and studies related to specific industries.
Performing analyses of data collected from surveys.
Participating in meetings with clients to discuss project objectives, budgets, and timelines.
Providing consulting services to clients by identifying problems and recommending solutions.","Giving all the required information to Clients.","Full-time","Bachelor degree in any discipline","Age 22 to 30 years","Dhaka (GULSHAN 2)","Tk. 20000 - 30000 (Monthly)""jobTitle","category","companyName","vacancy","jobContext","jobDescription","employmentStatus","educationalReq","additionalReq","jobLocation","salary"
"Research Analyst/ Research Officer","Research Consultancy","Emerging Credit Rating Limited","Not specific","Collect operational and financial data from customer.
Conduct field visit and fill prescribed visit form of ECRL.
Conduct telephone interview with client.
Analyze credit data and financial statements/information and report it to supervisor. 
Generate financial ratios to evaluate customer's financial status.
Conducting desktop research, and using books, journal articles, newspaper sources, questionnaires, surveys, polls, and interviews to gather data.
Prepare credit analysis report and interpretation of financial statements and related reports.","Collect operational and financial data from customer.","Full-time","Bachelor of Business Administration (BBA)","Age at most 35 years","Anywhere in Bangladesh","Negotiable""jobTitle","category","companyName","vacancy","jobContext","jobDescription","employmentStatus","educationalReq","additionalReq","jobLocation","salary"
"প্রশিক্ষক (দর্জি/কুটির শিল্প)","Research Consultancy","আবেদ-শিরিন ফাউন্ডেশন","238","আবেদ শিরিন ফাউন্ডেশন একটি আত্মকর্মসংস্থান ও সেবামূলক প্রতিষ্ঠান। প্রতিষ্ঠান কার্যক্রম পরিচালনার জন্য এবং উদ্যোক্তা সৃষ্টির মাধ্যমে আত্মকর্মসংস্থান প্রকল্প বাস্তবায়নের লক্ষ্যে খুলনা জেলার প্রতিটি উপজেলায় কিছুসংখ্যক শিক্ষানবিশ/ দক্ষ জনবল নিয়োগ করা হবে। বেতন-ভাতা আলোচনা সাপেক্ষে।
বি: দ্র- কোন ধরনের জামানতের প্রয়োজন নেই  ।","আবেদ শিরিন ফাউন্ডেশন একটি আত্মকর্মসংস্থান ও সেবামূলক প্রতিষ্ঠান। প্রতিষ্ঠান কার্যক্রম পরিচালনার জন্য এবং উদ্যোক্তা সৃষ্টির মাধ্যমে আত্মকর্মসংস্থান প্রকল্প বাস্তবায়নের লক্ষ্যে খুলনা জেলার প্রতিটি উপজেলায় কিছুসংখ্যক শিক্ষানবিশ/ দক্ষ জনবল নিয়োগ করা হবে। বেতন-ভাতা আলোচনা সাপেক্ষে।","Full-time","SSC","Age at least 18 years","খুলনা, বাগেরহাট, সাতক্ষীরা","Negotiable""jobTitle","category","companyName","vacancy","jobContext","jobDescription","employmentStatus","educationalReq","additionalReq","jobLocation","salary"
"Research & Development Executive","Research Consultancy","Biddabari","10","We are looking for open-minded, disciplined, intelligent and honest team members who are willing to work together with us for a Long Time.
The Academic Specialists will be responsible for delivering high-quality learning services to our platform users. The position requires excellent communication and interpersonal skills, strong subject knowledge in their respective fields, and a passion for deep learning.","We are looking for open-minded, disciplined, intelligent and honest team members who are willing to work together with us for a Long Time.","Full-time","Masters degree in any discipline","Age 28 to 35 years","Dhaka","Tk. 15000 - 30000 (Monthly)-Age at least 28 years (above 30 years will get preference)
The Candidates who are willing to build their career with a progressive Start-up and want to take challenges to develop and improve personal and professional skill will be highly appreciated. And The Applicants who passed at least once in BCS or Govt. Bank preliminary exam will get preference.""jobTitle","category","companyName","vacancy","jobContext","jobDescription","employmentStatus","educationalReq","additionalReq","jobLocation","salary"
"Analyst / Consultant, Management Consultancy","Research Consultancy","PricewaterhouseCoopers Bangladesh Private Limited","Not specific","PwC Bangladesh provides industry-focussed advisory services to public, private and government clients. The Management Consulting Group in PwC Bangladesh is committed to delivering value to our clients and ensuring long-term success. Our solutions and offerings spread across areas like Strategy, People; Change, Operations, Finance Effectiveness and Sustainability.
This position - which would be based out of Dhaka - calls for dynamic and aggressive consultants who would be engaged with our esteemed clients for the purpose of value delivery, initially under the supervision of the project managers. Delivery is the most critical] part of consulting business and our consultants need to ensure that they always meet the value that we have promised to deliver to our clients in every consulting engagement thereby strengthening the relationships with them.","PwC Bangladesh provides industry-focussed advisory services to public, private and government clients. The Management Consulting Group in PwC Bangladesh is committed to delivering value to our clients and ensuring long-term success. Our solutions and offerings spread across areas like Strategy, People; Change, Operations, Finance Effectiveness and Sustainability.","Full-time","Bachelor of Business Administration (BBA)","Age at most 35 years","Anywhere in Bangladesh","""jobTitle","category","companyName","vacancy","jobContext","jobDescription","employmentStatus","educationalReq","additionalReq","jobLocation","salary"
"Junior Research Associate","Research Consultancy","Emerging Credit Rating Limited","05","Provide support for various research activities related to economic issues.
Conduct feasibility analysis, financial modeling, and other related financial research.
Conduct analysis on the economic impact of policy actions, design quantitative models and propose legislative changes for industry groups.
Analyze technical and economic data, perform statistical studies, and develop forecasts for different customer and business types.
Maintain knowledge of various forecast models and suggest improvements when necessary.
Assist the team in arranging meetings with relevant stakeholders.
Collaborate with the Team Leader to prepare work plans, methods, draft reports, and finalize the reports.","Provide support for various research activities related to economic issues.","Full-time","Bachelor of Business Administration (BBA)","Age at most 35 years","Anywhere in Bangladesh","""jobTitle","category","companyName","vacancy","jobContext","jobDescription","employmentStatus","educationalReq","additionalReq","jobLocation","salary"
"Consultant for Investigation & Handling of Grievances","Research Consultancy","A Leading Multinational Development company.","3","We are looking for experienced candidates for the mentioned position","Assist to Supervisor to sort out the allegations and distribute the same to the respective investigator according to categories.","Full-time, Part-time, Contractual, Freelance","Bachelor of Law (LLB), Master of Business Administration (MBA), Bachelor degree in any discipline","Age at least 25 years","Anywhere in Bangladesh","Negotiable""jobTitle","category","companyName","vacancy","jobContext","jobDescription","employmentStatus","educationalReq","additionalReq","jobLocation","salary"
"Manager, Assurance","Research Consultancy","PricewaterhouseCoopers Bangladesh Private Limited","Not specific","S/he will be responsible for smooth implementation of ESG/CSR advisory projects and will assist PW Project Director in business development and project delivery.","Work across Bangladesh landscape in ESG/CSR and Social development sector across cross sectoral social/development sector thematic areas like health, education, WASH, skill development, livelihood, environment etc.","Full-time","Master of Education (M.Ed)","Age at most 50 years","Anywhere in Bangladesh","""jobTitle","category","companyName","vacancy","jobContext","jobDescription","employmentStatus","educationalReq","additionalReq","jobLocation","salary"
"Asst. General Manager - Production (Spinning Department)","Research Consultancy","Kung Keng Textile (BD) Co., Ltd. (A sister concern of Labib Group)","Not specific","Applicant must be experienced Spinning Department for Textile factory.
The applicants should have experience in the following areas - Spinning (Acrylic, wool, melange, cashmere like yarn).","Applicant must be experienced Spinning Department for Textile factory.","Full-time","B.Sc. in Textile Engineering from BUTEX  & any Public University.","Age 35 to 45 years","Dhaka (Savar EPZ)","Negotiable""jobTitle","category","companyName","vacancy","jobContext","jobDescription","employmentStatus","educationalReq","additionalReq","jobLocation","salary"
"Site Trial Coordinator","Research Consultancy","Toxicology Society of Bangladesh (TSB)","Not specific","Reports To: Site Principal Investigator / Senior Trial Manager (UOE).Job purpose: Provide a vital link between Clinical sites and TSB main office to implement the project process and systems in the sites. Ensure the day to day smooth functioning of investigator sites in terms of Patients Recruitment, Database Audit, Clinical trial Logistics and study documentations etc.Position Summary: Oversees site operational aspects of all clinical studies in the site and lead the in-house project staff (Clinical Research Fellow - CRF and Research Assistant-RA) toward maximum productivity of the site.Key RelationshipsTeam members directly interacting with this positionRAs, CRFs, Senior Trial Manager, Junior Trial Manager, RALM, Data ManagerOther stakeholders Principal Investigators / Co-InvestigatorsPostgraduate fellowsLocal collaborators: Study Physicians/Ward & Hospital StaffHospital Staffs","Reports To: Site Principal Investigator / Senior Trial Manager (UOE).","Full-time, Contractual","Masters degree in any discipline","Age 22 to 35 years","Mymensingh","Negotiable""jobTitle","category","companyName","vacancy","jobContext","jobDescription","employmentStatus","educationalReq","additionalReq","jobLocation","salary"
"Research and Development Manager","Research Consultancy","Datascape Research and Consultancy Limited","Not specific","Datascape Research & consultancy Ltd is an independent research and consulting firm with a global footprint across diverse industry verticals. This entity is established on 16 March 2016 and named Datascape social and market research and revamped its identity including a fresh new logo and brand identity registered under the company act XVII of 1994 with the registrar of joint-stock companies & firms as ""Datascape research and consultancy limited"" on its 7th anniversary aimed to large scale operation in the national and international market for aiding informed decision making. We have a panel of more than 600 trained research interviewers supported by 12 regional Coordinators and 36 supervisors.","Assisting in the preparation of literature reviews, developing research tools, data collection, and analysis.","Full-time","Master of Science (MSc)","Age 28 to 50 years","Dhaka","Negotiable""jobTitle","category","companyName","vacancy","jobContext","jobDescription","employmentStatus","educationalReq","additionalReq","jobLocation","salary"
"Media Fellowship","Research Consultancy","Oxfam","Not specific","Oxfam is a global movement of people working together to end the injustice of poverty.
Do you have at least 2-5 years of full-time reporting experience in mainstreamed Daily
Newspapers, Television Channels and Online Media Portals?
Do you have working knowledge on Renewable Energy/Sustainable Environment/Climate Change?
If the answer is yes, then we would like to hear from you!
About the Fellowship:
Although climate justice issues are widely discussed in the Bangladeshi media still there are some areas where journalism has space to be critical, particularly in the inequality and justice part of the climate action. Oxfam believes there is a lot of injustice inside the conventional climate action works where media can play a catalyst role to change the public narrative. The Renewable energy transition is a classic example of the Bangladesh case where most of the spotlight is on technology transformation ignoring the rights prospects of the vulnerable groups.
The fellowship will be awarded to five (5) journalists from (02 National Newspapers, 02 from National Television Channels and 01 from Online News Portals) aiming to get more visibility in terms of the wide range of audiences including policymakers, owner groups, workers and other relevant stakeholders. Selected Journalists will be given necessary trainings, mentorship sessions, relevant data and other supports.","Oxfam is a global movement of people working together to end the injustice of poverty.","Full-time","2 to 5 year(s)","","Anywhere in Bangladesh","""jobTitle","category","companyName","vacancy","jobContext","jobDescription","employmentStatus","educationalReq","additionalReq","jobLocation","salary"
"Manager, R&D (Solar Cell & Energy Generation)","Research Consultancy","East Coast Group","1","Work with internal & external stakeholders to identify and refine needs, formulate system requirements and develop method as per application in Solar PV module/ Renewable energy business.
Support in Technology roadmap for development of next generation products in PV Solar Module to support both off grid and on grid requirements.
Execute the new innovation of energy efficiency and application of converter typologies.
Lead the solar PV module design, component layout, prototype build up and subsequent verification, setup parameter for accessories & sourcing of equipment's and validation through testing in the R&D laboratories and develop requirements as per certification body.","Work with internal & external stakeholders to identify and refine needs, formulate system requirements and develop method as per application in Solar PV module/ Renewable energy business.","Full-time","Minimum B.Sc in EEE from reputed institution.","Age at least 33 years","Dhaka (Ashulia)","""jobTitle","category","companyName","vacancy","jobContext","jobDescription","employmentStatus","educationalReq","additionalReq","jobLocation","salary"
"Senior Consultant - Student Visa Processing (USA, Canada, Europe)","Research Consultancy","Law Office of Ehsan","1","We`re looking for a Senior Student Visa Consultant with 2+ years experience in student visa processing for the USA, Canada, Australia and Europe.","","Full-time","Bachelor degree in any discipline","Age 25 to 50 years","Dhaka (Banasree)","Tk. 30000 - 50000 (Monthly)""jobTitle","category","companyName","vacancy","jobContext","jobDescription","employmentStatus","educationalReq","additionalReq","jobLocation","salary"
"Executive Director, Direct Tax","Research Consultancy","PricewaterhouseCoopers Bangladesh Private Limited","Not specific","PwC provides professional services, including audit and assurance, tax and consulting, covering such areas as cybersecurity and privacy, human resources, deals, and forensics to clients in Bangladesh. We are hiring an Executive Director, Direct Tax to join the team in Dhaka.
We are seeking an Executive Director to lead the strategic growth of our Direct Tax practice, driving client relationships, business development, and compliance engagements.","PwC provides professional services, including audit and assurance, tax and consulting, covering such areas as cybersecurity and privacy, human resources, deals, and forensics to clients in Bangladesh. We are hiring an Executive Director, Direct Tax to join the team in Dhaka.","Full-time","Bachelor of Business Administration (BBA) in Finance","Age at most 60 years","Anywhere in Bangladesh","NegotiableUSD 94,700 - USD 98,400 (Annually)""jobTitle","category","companyName","vacancy","jobContext","jobDescription","employmentStatus","educationalReq","additionalReq","jobLocation","salary"
"Research and Development Manager","Research Consultancy","Datascape Research and Consultancy Limited","Not specific","Datascape Research & consultancy Ltd is an independent research and consulting firm with a global footprint across diverse industry verticals. This entity is established on 16 March 2016 and named Datascape social and market research and revamped its identity including a fresh new logo and brand identity registered under the company act XVII of 1994 with the registrar of joint-stock companies & firms as ""Datascape research and consultancy limited"" on its 7th anniversary aimed to large scale operation in the national and international market for aiding informed decision making. We have a panel of more than 600 trained research interviewers supported by 12 regional Coordinators and 36 supervisors.","Assisting in the preparation of literature reviews, developing research tools, data collection, and analysis.","Full-time","Master of Science (MSc)","Age 28 to 50 years","Dhaka","Negotiable""jobTitle","category","companyName","vacancy","jobContext","jobDescription","employmentStatus","educationalReq","additionalReq","jobLocation","salary"
